{
  "$schema": "https://json-schema.org/draft/2020-12/schema",
  "$id": "https://github.com/epi13/mncs-actions/blob/main/schemas/badge.schema.json",
  "title": "MNCS Badge Sidecar",
  "description": "Deterministic machine-readable projection of an MNCS aggregate verdict (mncs.badge/1). The badge is presentation only: it binds to evidence by digest and revision identifiers but is never evidence itself. Only schema_version, label, and verdict are required; everything else is an optional binding. No timestamps: the document is a pure function of its inputs so identical inputs yield byte-identical output.",
  "type": "object",
  "required": [
    "schema_version",
    "label",
    "verdict"
  ],
  "properties": {
    "schema_version": {
      "const": "mncs.badge/1"
    },
    "label": {
      "type": "string",
      "minLength": 1,
      "maxLength": 64
    },
    "verdict": {
      "enum": ["PASS", "FAIL", "UNKNOWN", "INVALID"]
    },
    "subject": {
      "type": "object",
      "description": "What was verified: caller repository and subject commit. Carried verbatim; mncs-actions asserts nothing about them.",
      "properties": {
        "repository": { "type": "string" },
        "commit": { "type": "string" }
      },
      "additionalProperties": true
    },
    "evidence": {
      "type": "object",
      "description": "Bindings from the badge back to the aggregate evidence (digests) and declared boundary name.",
      "properties": {
        "boundary": { "type": "string" },
        "aggregate_digest": { "type": "string", "pattern": "^(sha256:)?[a-f0-9]{64}$" },
        "manifest_digest": { "type": "string", "pattern": "^(sha256:)?[a-f0-9]{64}$" }
      },
      "additionalProperties": true
    },
    "revisions": {
      "type": "object",
      "description": "Which mncs-actions revisions produced the underlying evidence: the executing implementation revision and, when asserted by the caller, the workflow carrier revision. Transport annotations only; no policy authority.",
      "properties": {
        "carrier_revision": { "type": "string" },
        "implementation_revision": { "type": "string" }
      },
      "additionalProperties": true
    }
  },
  "additionalProperties": true
}
