{"evidence":{"aggregate_digest":"abfbb293cf83a5fc0bae3260f7ca36cb3059eb2b924e0e11e09d909e59ab822d","boundary":"mncs-actions-orchestration-boundary","manifest_digest":"934dabbcf37da93b64b18611c2fc7fa668a6c012b6a84d7ca3ab562858269e45"},"label":"mncs-actions","revisions":{"carrier_revision":"20a18e94eeb5053a16cd1ba4b371736a676e16ce","implementation_revision":"6c38ccbcb11e0712ff52e0063e6c11bd52817ffc"},"schema_version":"mncs.badge/1","subject":{"commit":"756c3bced07c384b763b6d875ea0123165e441e3","repository":"epi13/mncs-actions"},"verdict":"FAIL"}
